,0,1,contains keyword
598,"Apple Fires Manager Who Complained, Allegedly for Leaking Data",0.6970925331115723,False
1391,Toyota Is Accused of Using Stolen Motor Technology in Rare Lawsuit ,0.697047233581543,False
206,US state sues to have Google declared as public utility,0.6970019340515137,False
491,Facebook employee called inflated ad metrics 'deeply wrong' -  BNN Bloomberg,0.6969950199127197,False
140,Google Could Have Violated Labor Laws: NYT,0.6969617009162903,False
322,Facebook : Britain fines Facebook $70 mln for breaching order in Giphy deal,0.6968605518341064,False
440,"Gucci, Facebook Slap Joint Lawsuit Against Unnamed Counterfeit Seller",0.696823000907898,False
774,"Gucci, Facebook Slap Joint Lawsuit Against Unnamed Counterfeit Seller",0.696823000907898,False
1379,China fines tech giants for failing to report 43 old deals,0.6967809200286865,False
1473,FTC charges computer chip supplier Broadcom with illegal monopolization,0.6966421604156494,False
400,Facebook recalls 4M Oculus Quest 2 headset components over rash issue,0.6966023445129395,False
1369,Apple loses key autos engineer to electric aviation startup Archer,0.6964527368545532,False
1323,Apple loses key autos engineer to electric aviation startup Archer,0.6964527368545532,False
569,Russia investigates complaint against Netflix over LGBT content,0.696434497833252,False
80,Microsoft Warns of Chinese Hackers Targeting Business Email Systems,0.6963889002799988,False
263,Unions fight for big tech transparency on ethics,0.6962791085243225,False
1463,FTC Sues to Block Nvidia Deal Over Antitrust Issues,0.6960797309875488,False
1197,Privacy activist files complaints against Apple’s tracking tool,0.6960347890853882,False
832,Amazon India Chief Defends Company Amid Calls For Ban Over Alleged FDI Violations,0.6957058906555176,False
142,"Google faces another EU probe over Google Assistant, BI reports",0.6956876516342163,False
43,Mozilla Study Alleges YouTube Search Algorithm Violates Own Policies: WSJ,0.6955140829086304,False
175,Mozilla Study Alleges YouTube Search Algorithm Violates Own Policies: WSJ,0.6955140829086304,False
348,Banks in dispute with Apple Pay over transaction fees,0.6954318881034851,False
972,Banks in dispute with Apple Pay over transaction fees,0.6954318881034851,False
475,US Antitrust Against The Big Tech,0.6953485012054443,False
699,US Antitrust Against The Big Tech,0.6953485012054443,False
1398,US Antitrust Against The Big Tech,0.6953485012054443,False
351,US Antitrust Against The Big Tech,0.6953485012054443,False
1425,US Antitrust Against The Big Tech,0.6953485012054443,False
24,US Antitrust Against The Big Tech,0.6953485012054443,False
1277,US Antitrust Against The Big Tech,0.6953485012054443,False
335,"Facebook whistleblower to headline Yale Law panel on tech's failures, fixes",0.6953153610229492,False
1281,"Tesla, Nio Battery Supplier CATL Sues Rival Over Allegations Of IP Violation",0.6952621340751648,False
1266,"Tesla, Nio Battery Supplier CATL Sues Rival Over Allegations Of IP Violation",0.6952621340751648,False
1265,"Tesla, Nio Battery Supplier CATL Sues Rival Over Allegations Of IP Violation",0.6952621340751648,False
1280,"Tesla, Nio Battery Supplier CATL Sues Rival Over Allegations Of IP Violation",0.6952621340751648,False
1445,"Tesla, Nio Battery Supplier CATL Sues Rival Over Allegations Of IP Violation",0.6952621340751648,False
880,YouTube Rival Rumble Sues Google Over Alleged Search Ranking Bias: WSJ,0.6952245235443115,False
544,YouTube Rival Rumble Sues Google Over Alleged Search Ranking Bias: WSJ,0.6952245235443115,False
265,YouTube Rival Rumble Sues Google Over Alleged Search Ranking Bias: WSJ,0.6952245235443115,False
373,"Australian media outlets liable for Facebook comments, court finds",0.6950668096542358,False
1318,Apple sues controversial cyber firm NSO Group to stop it using iPhones and other devices,0.6950304508209229,False
204,Google dangles paid upgrade to businesses using Gmail addresses,0.694911003112793,False
1056,EU takes legal action against AstraZeneca over COVID vaccine contract,0.6946574449539185,False
510,Judge Questions Why Facebook May Have Overpaid in Data Privacy Settlement,0.6944000720977783,False
679,Amazon India Accused of Copying Sellers’ Products And Rigging Search Results,0.6943312287330627,False
694,Amazon settles with employees allegedly fired for criticizing working conditions - CNBC,0.6942980289459229,False
691,Amazon Settles Labor Dispute With Fired Climate Activists,0.6941608190536499,False
127,Amazon Settles Labor Dispute With Fired Climate Activists,0.6941608190536499,False
1117,Apple puts iPhone manufacturer on probation following labor violations,0.694140613079071,False
485,Facebook Inflated Its Advertising Audiences: Lawsuit,0.6940686106681824,False
27,Tesla sued over crash that injured Houston-area police officers,0.6940487027168274,True
517,Facebook’s Misleading Campaign Against Apple’s Privacy Policy,0.6938475966453552,False
536,Google threatens to pull its search engine from Australia,0.693602442741394,False
259,Google threatens to pull its search engine from Australia,0.693602442741394,False
116,Russia Penalizes Google For Retaining Banned Content: Reuters,0.6935110688209534,False
1180,"Apple To Press Ahead On Mobile Privacy, Despite Facebook Protests",0.693447470664978,False
1380,Tesla faces investor lawsuit over Musk tweets on 10% stock sales,0.6933258771896362,False
702,Amazon Bans 600 Chinese Brands For Fake Reviews,0.693315863609314,False
1062,"Meta Disputes Report It Halted Work on AR, VR Operating System",0.6932970285415649,False
1061,"Meta Disputes Report It Halted Work on AR, VR Operating System",0.6932970285415649,False
1059,"Meta Disputes Report It Halted Work on AR, VR Operating System",0.6932970285415649,False
52,JEDI Program Could Be Dropped Amid Amazon-Microsoft Controversy,0.6932872533798218,False
767,JEDI Program Could Be Dropped Amid Amazon-Microsoft Controversy,0.6932872533798218,False
1030,India's antitrust body orders probe into Apple over alleged abuse of app market,0.692973792552948,False
292,Facebook loses bid for new 3rd Circuit review of news anchor's lawsuit,0.692847728729248,False
32,"Microsoft warns of cloud computing customers of exposed databases, Reuters says",0.6927831172943115,False
173,Google faces fresh antitrust suit from states targeting Play Store,0.6926084756851196,False
913,Google faces fresh antitrust suit from states targeting Play Store,0.6926084756851196,False
804,Obama Official Defends Amazon Against Worker Mistreatment Allegations,0.6925470232963562,False
735,Internet outages reported as Akamai probes problem,0.6925165057182312,False
1035,Internet outages reported as Akamai probes problem,0.6925165057182312,False
1101,China slams US media silence over Pfizer vaccine deaths in Norway,0.6924359798431396,False
983,Visa Concerned Over India’s Backing for Rival RuPay,0.6922156810760498,False
970,Visa Concerned Over India’s Backing for Rival RuPay,0.6922156810760498,False
128,Russia fines Google for failing to delete banned content,0.6920623779296875,False
1322,"Italian Antitrust Regulator Penalizes Google, Apple",0.6920467019081116,False
878,Amazon says violent posts prompted Parler shutdown,0.6918927431106567,False
467,Former Facebook Insider Explains Zuckerberg's Privacy War with Apple,0.6917869448661804,False
795,Labor board finds Amazon illegally fired activist workers,0.6917638778686523,False
403,Facebook fires back at Biden over vaccine misinformation,0.6914718151092529,False
981,Apple Legal Woes Mount As EU Watchdog Files Antitrust Charges,0.6914318799972534,False
385,FTC files renewed antitrust complaint against Facebook,0.6914126873016357,False
413,Government Antitrust Lawsuits Against Facebook Thrown Out by Federal Judge,0.6913532018661499,False
427,Netflix criticized by Chinese online over use of Taiwan flag,0.6912590265274048,False
1394,"GM's Cruise disputes San Francisco concerns on stops, says 'double parking' legal",0.6909352540969849,False
611,National Labor Relations Board Fields Complaints About Apple,0.690893828868866,False
323,Britain fines Facebook $70 mln for breaching order in Giphy deal,0.6907714605331421,False
1249,Intel Sues Former Employee For Alleged Theft of Xeon Data - ExtremeTech,0.6907024383544922,False
873,New lawsuit accuses Amazon of e-book price fixing,0.6906300783157349,False
777,"Union Appeals Amazon Election in Alabama, Says Company Violated Laws",0.690629243850708,False
478,Facebook Employee Called Inflated Ad Metrics 'Deeply Wrong',0.6905090808868408,False
783,Union Drive At Amazon Warehouse Fails After Bitter Campaign,0.6903867125511169,False
1304,Female employee files sexual harassment lawsuit against Tesla,0.6903681755065918,False
207,"Ohio AG sues Google, claiming it’s a public utility",0.6902774572372437,False
914,"Walmart recalls room spray on bacteria fears after two deaths, Bloomberg says",0.6901546716690063,False
551,Tesla-Built 'Big Battery' Allegedly Failed To Provide Essential Services in Australia — Operator Gets Sued By Energy Regulator,0.6900606155395508,True
917,Walmart sued by EEOC for sexual harassment,0.6899526715278625,True
340,Facebook Files To Dismiss FTC's Monopolization Allegations,0.6899420619010925,False
62,"Microsoft Apologizes as Azure AD Outage Takes Out Teams, Exchange",0.6898894309997559,False
334,Australia wants Facebook held liable for anonymous comments,0.6898589730262756,False
55,EU charges Apple with breaking antitrust law over Spotify,0.6897265911102295,False
437,EU charges Apple with breaking antitrust law over Spotify,0.6897265911102295,False
771,EU charges Apple with breaking antitrust law over Spotify,0.6897265911102295,False
1181,Apple accuses Facebook of 'disregard for user privacy',0.6895316243171692,False
113,Russia fines Google again over banned content,0.68951416015625,False
791,NLRB: Amazon Illegally Fired Activist Employees,0.6895008087158203,False
1292,BMW Missing Out on China’s Karaoke Fans Exposes Digital Car Gap,0.6893917322158813,False
710,Amazon faces new antitrust claims from DC attorney general,0.689346194267273,False
366,Apple Faces Protests Outside Retail Stores Over Privacy Concerns With iPhone CSAM Feature,0.6893388628959656,False
589,Apple Faces Protests Outside Retail Stores Over Privacy Concerns With iPhone CSAM Feature,0.6893388628959656,False
30,"Big Tech pressured by House committee over January attack on Capitol, Verge says",0.68927401304245,False
146,"Big Tech pressured by House committee over January attack on Capitol, Verge says",0.68927401304245,False
376,"Big Tech pressured by House committee over January attack on Capitol, Verge says",0.68927401304245,False
823,Amazon issues rare apology in India after complaints that series hurt Hindu beliefs | Entertainment,0.6892350912094116,False
733,Amazon Hit With Record EU Privacy Fine ,0.6892232894897461,False
1227,Apple Faces Shareholder Class-Action Suit over CEO's China Sales Comments,0.6891287565231323,False
1401,Ford counterattacks in 'cruise' dispute with GM,0.6890789270401001,False
1432,Ford counterattacks in 'cruise' dispute with GM,0.6890789270401001,False
879,"Future Group is misleading regulators, alleges Amazon",0.6890672445297241,False
857,Amazon sues New York attorney general to preempt a state COVID lawsuit,0.6890534162521362,False
741,Federal regulator sues Amazon to force recall of hazardous products,0.6889611482620239,False
740,Federal regulator sues Amazon to force recall of hazardous products,0.6889611482620239,False
203,Apple Back in Washington Spotlight Over Trump-Era Subpoenas,0.6888540983200073,False
47,Apple Back in Washington Spotlight Over Trump-Era Subpoenas,0.6888540983200073,False
942,Apple Back in Washington Spotlight Over Trump-Era Subpoenas,0.6888540983200073,False
233,Russia Threatens Twitter Suspension Over Alleged Banned Content: Reuters,0.6885726451873779,False
466,Russia Threatens Twitter Suspension Over Alleged Banned Content: Reuters,0.6885726451873779,False
255,"Google Threatens to Disable Search Engine in Australia, Policy Makers Cry 'Blackmail'",0.6884799003601074,False
763,Amazon Announces Lawsuit to Combat Fraudulent Affiliate Marketing Schemes,0.6883186101913452,False
999,PRESS: Wells Fargo faces extra account fraud fines - Bloomberg,0.6883023381233215,False
1097,"Apple Punished Employee for Approving App That Was Critical of Beijing, Lawsuit Alleges",0.6882697939872742,False
861,Amazon investors warn against playing dirty on union vote,0.6882116198539734,False
1200,"Apple illegally tracks iPhone users to target them with ads, EU privacy activism group claims in lawsuit",0.6881009936332703,False
91,Microsoft Conclusion on SolarWinds Hack 'Conflicts' with Other Messages,0.6880916953086853,False
586,Google fined $270M from France over ad practices,0.6880077123641968,False
210,Google fined $270M from France over ad practices,0.6880077123641968,False
48,Google fined $270M from France over ad practices,0.6880077123641968,False
423,Google fined $270M from France over ad practices,0.6880077123641968,False
952,China Warns 34 Tech Firms to Curb Excess in Antitrust Review,0.6879829168319702,False
482,Facebook Accused of Bullying by UK Lawmaker and Publishers Over News Sharing Ban,0.687981128692627,False
557,Facebook warns it is 'underreporting' iOS ad results amid Apple privacy changes,0.6879225969314575,False
357,Facebook warns it is 'underreporting' iOS ad results amid Apple privacy changes,0.6879225969314575,False
561,Facebook warns it is 'underreporting' iOS ad results amid Apple privacy changes,0.6879225969314575,False
436,Facebook warning to advertisers after iPhone privacy crackdown,0.6879053115844727,False
327,Facebook paying fine to settle US suit on discrimination,0.6878929138183594,False
153,Russia Penalizes Google For Retaining Illegal Content: Reuters,0.6877443790435791,False
692,Amazon Settles Dispute With Two Employees Who Were Fired,0.6877238750457764,False
399,Top German court strikes down Facebook rules on hate speech,0.687604546546936,False
1048,Facebook accuses Apple of self-serving new privacy policy,0.687475323677063,False
1194,European Activist Files Complaints Against Apple’s Tracking Tool,0.6873570680618286,False
728,Amazon and GoPro File Joint Lawsuit against Counterfeiters,0.6873185038566589,False
731,"Congress Pushes Back on Amazon, Facebook in Antitrust Dispute",0.6873173713684082,False
397,"Congress Pushes Back on Amazon, Facebook in Antitrust Dispute",0.6873173713684082,False
382,FTC files amended complaint against Facebook,0.6872738599777222,False
1267,Tesla Strikes Deal With Top Miner BHP Over Nickel Supplies,0.6872623562812805,False
530,Google Threatens to Remove Search Engine in Australia Over Proposed Law,0.6871832013130188,False
248,Google Threatens to Remove Search Engine in Australia Over Proposed Law,0.6871832013130188,False
41,"Microsoft Exchange hack caused by China, US and allies say",0.6868279576301575,False
918,Walmart must face bias claim by worker regularly absent post-injury -1st Circ,0.6868051290512085,False
801,Amazon apologizes for tweet denying some workers urinate in bottles,0.6867190599441528,False
852,Amazon Sues New York Attorney General Letitia James Over Threat of Legal Action,0.6867103576660156,False
884,Parler Sues Amazon After Tech Giant Kicks Site Off Its Servers,0.6866387128829956,False
268,Parler Sues Amazon After Tech Giant Kicks Site Off Its Servers,0.6866387128829956,False
1126,Initial investigation of Wistron India violence finds 'labour violations',0.6866286993026733,False
448,Muslim civil rights group sues Facebook over hate speech,0.6864585876464844,False
1054,Italy consumer association sues Apple for planned iPhone obsolescence,0.6864508986473083,False
442,"Gucci, Facebook file joint lawsuit against alleged counterfeiter",0.6864081621170044,False
775,"Gucci, Facebook file joint lawsuit against alleged counterfeiter",0.6864081621170044,False
242,Big problem with Google’s ‘coffee shop’ comparison,0.6863697171211243,False
434,"44 Attorney Generals Oppose Instagram Youth Launch Over Mental, Privacy Concerns: Bloomberg",0.6863669157028198,False
758,Amazon again loses bid for SCOTUS review on FAA exemption,0.6863390803337097,False
486,"Unfazed by Facebook news blackout, Australia pushes on with content law",0.686301589012146,False
1373,Jury Finds Pharmacy Chains Contributed to Opioid Crisis,0.68621826171875,False
904,Jury Finds Pharmacy Chains Contributed to Opioid Crisis,0.68621826171875,False
947,Jury Finds Pharmacy Chains Contributed to Opioid Crisis,0.68621826171875,False
1175,Apple security chief indicted on bribery charges in gun-permit scandal,0.6860901713371277,False
254,Google threatens to shut down search in Australia over digital news code – video,0.6860546469688416,False
866,Apple Delays Office Return as Covid-19 Delta Variant Spreads ,0.6855965852737427,False
165,Apple Delays Office Return as Covid-19 Delta Variant Spreads ,0.6855965852737427,False
738,Apple Delays Office Return as Covid-19 Delta Variant Spreads ,0.6855965852737427,False
402,Apple Delays Office Return as Covid-19 Delta Variant Spreads ,0.6855965852737427,False
828,Amazon Sued for 'Systemic Pattern' of Anti-Black Racism and Equal Pay Act Violations,0.6855581998825073,True
320,Britain fines Facebook $70 million for breaching order in Giphy deal,0.6854631900787354,False
1218,Apple freezes new business for Pegatron on China Labour abuse,0.6854104399681091,False
1169,Apple Sued For $200M In EU Over Allegations It Deliberately Slowed Down iPhones To Mask Battery Issues,0.6854009628295898,True
416,Amazon Employee Reports Veiled Threat From Bribery Defendant,0.6853264570236206,False
749,Amazon Employee Reports Veiled Threat From Bribery Defendant,0.6853264570236206,False
713,Twitch Targets Online Harassment in New Lawsuit Against Two Users,0.6852582693099976,False
28,"India antitrust probe finds Google abused Android dominance, report shows",0.6852366924285889,False
573,"India antitrust probe finds Google abused Android dominance, report shows",0.6852366924285889,False
136,"India antitrust probe finds Google abused Android dominance, report shows",0.6852366924285889,False
707,"India antitrust probe finds Google abused Android dominance, report shows",0.6852366924285889,False
572,"India antitrust probe finds Google abused Android dominance, report shows",0.6852366924285889,False
477,UK culture secretary warns Facebook after news ban in Australia,0.6852191686630249,False
78,Biden administration warns about Microsoft email hack that company blamed on China,0.685034990310669,False
71,"EU watchdog's emails hacked, Microsoft blames Chinese group",0.6848321557044983,False
1136,Facebook criticizes Apple privacy policy in newspaper ads,0.6848102807998657,False
1132,Facebook criticizes Apple privacy policy in newspaper ads,0.6848102807998657,False
1295,Apple's software boss warns against draft EU policy on App Store,0.6847926378250122,False
435,Russia seeks extra fines against Twitter over 'banned content' -TASS,0.684768557548523,False
595,Apple Stock Fell After Judge Issues a ‘Legal Blow’ Against App Store,0.6847240924835205,False
1368,Tesla disrupted by traditional mechanics,0.6847070455551147,False
1066,Google and Facebook Hit With French Fines for Making It Difficult to Reject Cookies,0.6845775842666626,False
1070,Google and Facebook Hit With French Fines for Making It Difficult to Reject Cookies,0.6845775842666626,False
359,"Facebook warned by Ireland, Italy over smart glasses recording indicator",0.6844766736030579,False
853,Amazon sues New York attorney general to block regulation on its pandemic response,0.6844362616539001,False
1068,Lawsuit Aims To Hold Facebook Liable For Death Of Federal Security Guard: WSJ,0.6841334700584412,False
1106,Google Infringed Sonos' Patent: US Regulators,0.6839826107025146,False
1105,Google Infringed Sonos' Patent: US Regulators,0.6839826107025146,False
288,EU court adviser says German consumer body may sue Facebook for privacy breaches,0.6839613318443298,False
1084,Pfizer accused of illegal drug pricing by UK competition regulator,0.6839475035667419,False
239,Robinhood Negative Reviews Deleted by Google from Play Store Due to Review System Abuse!,0.683901309967041,False
851,Amazon Sues New York Attorney General to Block Covid-19 Charges,0.6837799549102783,False
721,Russia fines Google again for not removing illegal content,0.6837781667709351,False
387,Russia fines Google again for not removing illegal content,0.6837781667709351,False
152,Russia fines Google again for not removing illegal content,0.6837781667709351,False
15,Microsoft warns hackers behind SolarWinds attack are targeting cloud services,0.6836528778076172,False
1330,Apple's alleged restriction on workers' Slack use sparks labor complaint,0.6835399866104126,False
1344,Apple's alleged restriction on workers' Slack use sparks labor complaint,0.6835399866104126,False
991,EU accuses Apple of antitrust breach after Spotify complaint,0.6834912896156311,False
219,EU accuses Apple of antitrust breach after Spotify complaint,0.6834912896156311,False
772,EU accuses Apple of antitrust breach after Spotify complaint,0.6834912896156311,False
584,SEC charges Netflix engineers with $3 million insider trading ring,0.6834002733230591,False
1279,China’s Weibo Fires PR Executive Over Bribery Allegations,0.6830734014511108,False
652,Apple appeals against security research firm while touting researchers,0.6830567121505737,False
648,Apple appeals against security research firm while touting researchers,0.6830567121505737,False
647,Apple appeals against security research firm while touting researchers,0.6830567121505737,False
680,Amazon's Twitch blames configuration error for data breach,0.6829149723052979,False
1283,Exclusive - China's IPO-bound Didi probed for antitrust violations - sources,0.6828336715698242,False
1284,EXCLUSIVE-China's IPO-bound Didi probed for antitrust violations - sources,0.6828336715698242,False
1285,EXCLUSIVE-China's IPO-bound Didi probed for antitrust violations - sources,0.6828336715698242,False
1251,Intel sues ex-employee for USB stick Xeon files theft – Blocks and Files,0.6828253269195557,False
290,Facebook says it disagrees with UK ruling on Giphy deal,0.6827340126037598,False
750,UK Government Probes Amazon And Google Over Handling Of Fake Reviews,0.6826894879341125,False
185,UK Government Probes Amazon And Google Over Handling Of Fake Reviews,0.6826894879341125,False
492,QUOTES-Reaction to Facebook blocking Australian news | Technology,0.6824459433555603,False
275,Google workers form union amid ongoing feuds with execs,0.6823635101318359,False
229,"Daily Mail Owner Files Antitrust Suit Against Google, Citing Royals Coverage",0.6822817325592041,False
1147,Big tech firms to face 6% fines if breach new EU content rules,0.6820476055145264,False
529,Australia Risks Confrontation With Biden Administration Over Big Tech: Expert,0.6820312738418579,False
245,Australia Risks Confrontation With Biden Administration Over Big Tech: Expert,0.6820312738418579,False
370,Facebook : accused of gender discrimination in job adverts,0.6818791627883911,False
833,Allegations of dodging laws have malicious intent: Amazon India chief,0.6816727519035339,False
283,"Russia fines Google over content, bigger penalty looms",0.6816203594207764,False
107,"Russia fines Google over content, bigger penalty looms",0.6816203594207764,False
778,Amazon loses bid to escape $5 million patent verdict over Alexa tech,0.6815861463546753,False
1122,Apple puts supplier Wistron on notice after Indian factory violence | Technology,0.6814677715301514,False
1123,Apple puts supplier Wistron on notice after Indian factory violence | Technology,0.6814677715301514,False
966,"HSBC, Barclays confronted by naked Extinction Rebellion protesters",0.681459903717041,False
358,Facebook Questioned by Oversight Board Over Celebrity Rules,0.681246280670166,False
235,CMA To Probe Apple Over App Store Antitrust Allegations: Bloomberg,0.6811256408691406,False
1027,CMA To Probe Apple Over App Store Antitrust Allegations: Bloomberg,0.6811256408691406,False
612,Cisco : New Tech Fights Suicide with Analytics,0.6810771226882935,False
13,Microsoft settles with DOJ over immigration-related discrimination claims,0.6810690760612488,False
605,Apple delays system to scan iPhones for child sex abuse content,0.6810197830200195,False
226,Roku warns YouTube TV could be removed from platform,0.6806946992874146,False
1162,Few iPhone 12 Pro owners report battery drainage issue,0.6806585788726807,False
100,Google is under investigation over its treatment of Black female workers,0.6804044246673584,False
339,Facebook blames outage on configuration change,0.6802256107330322,False
1412,Mexican union vote halted at GM plant; vote fixing alleged,0.6801537275314331,False
925,"Mexican elderly lose work as grocery baggers, protest",0.6801496744155884,False
401,Russia fines Facebook and Twitter for failing to delete content,0.6800398826599121,False
810,Former worker sues Amazon for not providing lunch breaks,0.6800101399421692,False
678,"Amazon executive addressed complaints about 'toxic' culture, BI reports",0.6798245906829834,False
1436,GM Warns Bolt EV Owners About Fires From Batteries,0.6796634793281555,False
1405,GM Warns Bolt EV Owners About Fires From Batteries,0.6796634793281555,False
1178,"Apple, GroupM, others ask for tough protection for data in Google lawsuit",0.6796342134475708,False
742,Amazon Sued by U.S. Product-Safety Agency Over Dangerous Items,0.6796301007270813,True
464,Facebook fails in bid to derail $15b privacy suit,0.6796126961708069,False
726,Amazon to pay damages for dangerous goods sold by independent merchants,0.6795788407325745,False
1464,"Nvidia concessions to EU failed to address competition concerns, Reuters says",0.6795555353164673,False
380,Facebook hit with new version of FTC antitrust complaint,0.6794248223304749,False
902,"Ohio Jury Finds Walgreens, Walmart, CVS Liable In Opioid Crisis",0.6794224977493286,False
