,0,1,contains keyword
945,"Ohio Jury Finds Walgreens, Walmart, CVS Liable In Opioid Crisis",0.6794224977493286,False
79,Microsoft China Hack Leads to US Emergency Warning Againts Threat Actors,0.6794002652168274,False
570,Russia investigates Netflix after complaint over LGBT content,0.6793539524078369,False
1419,Lucid shares drop amid SEC subpoena over SPAC deal,0.6793532967567444,False
616,Exclusive-Apple hit with antitrust case in India over in-app payments issues,0.6793481707572937,False
615,Exclusive-Apple hit with antitrust case in India over in-app payments issues,0.6793481707572937,False
718,EXCLUSIVE-Apple hit with antitrust case in India over in-app payments issues,0.6793481707572937,False
618,EXCLUSIVE-Apple hit with antitrust case in India over in-app payments issues,0.6793481707572937,False
614,Exclusive-Apple hit with antitrust case in India over in-app payments issues,0.6793481707572937,False
1377,"Tesla hit with class-action suit over solar roof price hikes, BI reports",0.6793414354324341,False
1095,Apple's Copyright Infringement Claims Against Florida Security Startup Thrown Out By Court,0.6793088912963867,False
525,Facebook Oversight Board overturns hate speech and pandemic misinformation takedowns,0.6792897582054138,False
291,Apple sues company known for hacking iPhones on behalf of governments,0.679269552230835,False
954,Judge dismisses charges against Apple security chief in gun-permit probe,0.6792085766792297,False
1299,Asylum seekers face job losses amid USCIS delays: lawsuit,0.679193377494812,False
1371,Tesla Sued By JPMorgan Over Refusing To Pay Up $162M In Dispute Over Warrants,0.6791129112243652,True
963,Tesla Sued By JPMorgan Over Refusing To Pay Up $162M In Dispute Over Warrants,0.6791129112243652,True
587,Jury Finds Former Netflix VP Guilty Of Taking Kickbacks In Contract Deals,0.6790827512741089,False
1384,Apple shuts NYC stores as COVID-19 cases surge,0.6790424585342407,False
1374,Washington state in $95 billion opioid trial blames drug distributors for crisis,0.6789711713790894,False
899,California sues Walmart over disposal of hazardous waste,0.6788774728775024,False
1356,Epic Games opposes Apple's effort to pause antitrust trial orders,0.6788510680198669,False
1361,Epic Games opposes Apple's effort to pause antitrust trial orders,0.6788510680198669,False
1188,Apple faces privacy case in Europe over iPhone tracking ID,0.6788119077682495,False
1018,Reuters postpones website paywall amid Refinitiv dispute,0.6787176728248596,False
1365,Driver of Tesla involved in Paris accident under formal investigation - BFM TV,0.6786067485809326,False
361,Facebook : Ireland raises privacy question over Facebook smart glasses,0.6785930395126343,False
897,California sues Walmart over illegal dumping of hazardous waste,0.6785331964492798,False
887,"US protests: Amazon, Apple and Google cut off Parler",0.6784027218818665,False
1073,"US protests: Amazon, Apple and Google cut off Parler",0.6784027218818665,False
38,Biden Administration Blames Hackers Tied to China for Microsoft Cyberattack Spree,0.6783498525619507,False
494,Australia treasurer calls Facebook 'wrong' to block news feeds,0.6782457828521729,False
673,"Satellite Fleets Risk Collisions in Space, Former NASA Head Says",0.6781324744224548,False
723,Microsoft protests Amazon win of big US cloud contract,0.6781028509140015,False
34,Microsoft protests Amazon win of big US cloud contract,0.6781028509140015,False
272,Is Google Avoiding iOS Updates & Privacy Labels?,0.6780495047569275,False
693,Amazon Settles Case With Two Employees Who Said They Were Wrongly Fired,0.6779519319534302,False
108,Google warns crypto miners are hacking cloud accounts ,0.6779512166976929,False
295,Ohio Sues Meta Alleging Facebook Parent Misled Public About Its Products’ Effect on Children,0.6779121160507202,False
545,The antitrust case against Facebook is bad economic policy,0.6778144836425781,False
933,The antitrust case against Facebook is bad economic policy,0.6778144836425781,False
1072,The antitrust case against Facebook is bad economic policy,0.6778144836425781,False
885,The antitrust case against Facebook is bad economic policy,0.6778144836425781,False
269,The antitrust case against Facebook is bad economic policy,0.6778144836425781,False
1291,The antitrust case against Facebook is bad economic policy,0.6778144836425781,False
969,TOP NEWS: Apple faces legal action in UK over App Store charges,0.6777615547180176,False
209,Google fined $268 million by France for unfair advertisement practices,0.6776592135429382,False
1312,Amazon and Apple handed $225 million in Italian antitrust fines,0.6774768829345703,False
657,Amazon and Apple handed $225 million in Italian antitrust fines,0.6774768829345703,False
1308,Amazon and Apple handed $225 million in Italian antitrust fines,0.6774768829345703,False
920,"Amazon, Walmart Unit Face India Antitrust Probe on Court Order",0.6774362325668335,False
729,"Amazon, Walmart Unit Face India Antitrust Probe on Court Order",0.6774362325668335,False
428,EU probes Facebook's Kustomer buyout over data concern,0.6773183345794678,False
674,Amazon Missed French Deliveries Goal After Warehouse Closures,0.677261471748352,False
1448,Tesla fans check out Chinese rivals as company faces scrutiny,0.6772388219833374,False
1360,Epic Games Opposes Apple`s Effort To Pause Antitrust Trial Orders,0.6772169470787048,False
844,Amazon accused of lax virus safety in New York AG’s lawsuit,0.6771310567855835,False
1118,Apple Shuts California Stores Due To Rising COVID-19 Cases – Report,0.6771221160888672,False
766,Amazon blocked 10 billion listings in crackdown against counterfeits,0.6771096587181091,False
19,Microsoft says it warned Bill Gates about flirtatious emails in 2008,0.6770299673080444,False
1216,Apple Freezes Business with iPhone Assembler Pegatron over 'Student Worker' Violations,0.6770089864730835,False
441,Russia fines Apple $12 mln for apps market abuse,0.6769781112670898,False
1006,Russia fines Apple $12 mln for apps market abuse,0.6769781112670898,False
1296,Blue Origin Loses Lawsuit Against NASA Over SpaceX Lunar Contract,0.6768418550491333,False
667,Blue Origin Loses Lawsuit Against NASA Over SpaceX Lunar Contract,0.6768418550491333,False
1057,"AAPL Stock Slightly Up, Apple Sued for Failing to Remove Telegram from App Store",0.6767401695251465,True
135,"India antitrust probe finds Google abused Android dominance, Reuters reports",0.6767178177833557,False
171,Trump Sues to Force Way Back Into Social Media,0.67670077085495,False
1217,Apple suspends iPhone assembler Pegatron over labor violations in China,0.6766483783721924,False
1443,Globe editorial: The Ford government is harming Ontario’s environmental future,0.6765164136886597,False
498,Facebook cuts off news in Australia in fight over payments,0.676415205001831,False
592,Epic Files Appeal After Loss to Apple in App Store Case,0.6763967275619507,False
367,Epic Files Appeal After Loss to Apple in App Store Case,0.6763967275619507,False
139,Epic Files Appeal After Loss to Apple in App Store Case,0.6763967275619507,False
711,Epic Files Appeal After Loss to Apple in App Store Case,0.6763967275619507,False
218,"Roku pulls YouTube TV from channel store amid Google dispute, Verge says",0.6763368844985962,False
411,Former President Trump files lawsuit against social media companies,0.6759035587310791,False
179,Former President Trump files lawsuit against social media companies,0.6759035587310791,False
1094,Lawsuit: Apple Punished Employee for Approving App Critical of Communist China,0.6758219003677368,False
1199,Apple has been hit with privacy complaints from the same digital activist who successfully took on Facebook,0.6757909655570984,False
1177,"Apple, AT&T ask for tough protection for data in Google lawsuit",0.6757261753082275,False
1179,"Apple, AT&T ask for tough protection for data in Google lawsuit",0.6757261753082275,False
1050,EU investigating Moderna vaccine contamination incident,0.6756690740585327,False
813,Amazon workers strike in Italy over pandemic-driven delivery demands,0.675654947757721,False
826,Lawsuit accuses Amazon of ''systemic'' racism in corporate offices,0.6756372451782227,False
148,Apple and Google Hit by South Korean App-Payment Law,0.6756312251091003,False
624,Apple and Google Hit by South Korean App-Payment Law,0.6756312251091003,False
659,Amazon and Apple handed $225 million Italian fine for alleged collusion,0.6755678653717041,False
1313,Amazon and Apple handed $225 million Italian fine for alleged collusion,0.6755678653717041,False
1310,Amazon and Apple handed $225 million Italian fine for alleged collusion,0.6755678653717041,False
1309,Amazon and Apple handed $225 million Italian fine for alleged collusion,0.6755678653717041,False
706,UK PM Johnson to challenge Amazon founder Bezos over company's tax record- FT,0.6755462288856506,False
646,Amazon Settles Suit Over Alleged Fake Cashmere Products,0.6754554510116577,False
1220,Apple Suspends New Business With Pegatron Over Labor Violations,0.6753942966461182,False
787,Labor board says Amazon illegally fired outspoken workers,0.6753618717193604,False
797,Labor board says Amazon illegally fired outspoken workers,0.6753618717193604,False
623,NHS digital under scrutiny for ties with Accenture,0.6753281354904175,False
311,"Facebook : knew about, failed to police, abusive content globally - documents",0.6752256155014038,False
863,Amazon has lost its bid to delay Alabama union vote,0.6752022504806519,False
538,Facebook under pressure to resume scanning messages for child abuse in EU,0.675048828125,False
1189,Apple hits back at activist complaints against tracking tool - TechCentral,0.674957811832428,False
759,"Indian court deals blow to Amazon, Walmart's Flipkart in antitrust case",0.6749473810195923,False
858,Amazon sues NY AG Letitia James to stave off potential COVID-19 lawsuit,0.674929141998291,False
296,"UPDATE 1-Cuba threatens to sue Facebook, alleging it aided dissidents",0.6748833656311035,False
59,Apple Hit With Class Action On Allegations Of Running An 'Unlicensed Casino',0.674808144569397,False
677,Amazon Is Lost In The Jungle,0.6746839284896851,False
183,YouTube faces close scrutiny in Europe’s new Google probe,0.6745513677597046,False
697,Amazon settles with employees allegedly fired for criticizing working conditions,0.6745229959487915,False
688,Amazon settles with employees allegedly fired for criticizing working conditions,0.6745229959487915,False
346,Amazon settles with influencers 'who ran social media counterfeiting scheme',0.6745193600654602,False
689,Amazon settles with influencers 'who ran social media counterfeiting scheme',0.6745193600654602,False
14,"Apple speeds up autonomous car project, crypto group outbid for Constitution copy, Activision allegations draw Xbox concern",0.674505889415741,False
1302,"Apple speeds up autonomous car project, crypto group outbid for Constitution copy, Activision allegations draw Xbox concern",0.674505889415741,False
855,Amazon files preemptive lawsuit against New York AG,0.6744745969772339,False
194,Google Faces EU Antitrust Probe of Alleged Ad-Tech Abuses,0.6742962598800659,False
811,News Roundup: Amazon India Faces Delivery Worker Strike; Suspends Sellers & More,0.6742486953735352,False
1297,Apple loses bid for second bite at Qualcomm patents after license,0.6741575002670288,False
261,Google Denies Allegations of Secret Deal with Facebook to Dominate Ads,0.6741455793380737,False
541,Google Denies Allegations of Secret Deal with Facebook to Dominate Ads,0.6741455793380737,False
744,CPSC sues Amazon to force recall of hazardous products,0.6740248203277588,False
1258,Drug distributors face off against West Virginia in billion-dollar opioid trial,0.6740128993988037,False
1259,Drug distributors face off against West Virginia in billion-dollar opioid trial,0.6740128993988037,False
732,"Amazon to face a widening campaign against its labor practices, NY Times reports",0.6740114688873291,False
1144,Apple probing if Wistron facility in India flouted supplier rules,0.6739651560783386,False
661,Amazon and Apple handed $225 mln Italian fine for alleged collusion,0.6738464832305908,False
1314,Amazon and Apple handed $225 mln Italian fine for alleged collusion,0.6738464832305908,False
1093,Apple iPhone supplier accused of using Uighur forced labour in China,0.6738284230232239,False
1417,"Tesla Fails to Comply With Some Pollution Rules, EPA Says",0.6737382411956787,False
1358,Apple : once threatened Facebook ban over Mideast maid abuse,0.6735910773277283,False
1293,Tesla Apologizes To China State Power Company After Viral Video,0.6734743118286133,False
1472,Tesla Apologizes To China State Power Company After Viral Video,0.6734743118286133,False
1449,Tesla Apologizes To China State Power Company After Viral Video,0.6734743118286133,False
1416,Tesla Apologizes To China State Power Company After Viral Video,0.6734743118286133,False
1372,"Tesla accuses Rivian of stealing trade secrets, Bloomberg reports",0.6734696626663208,False
1423,"Tesla accuses Rivian of stealing trade secrets, Bloomberg reports",0.6734696626663208,False
687,"Tesla accuses Rivian of stealing trade secrets, Bloomberg reports",0.6734696626663208,False
1140,Facebook Accuses Apple of Hurting Small Businesses – Report,0.6734299659729004,False
1129,Facebook criticises Apple privacy policy in newspaper ads,0.6733691692352295,False
638,U.S. opens probe into Amazon warehouse fatal collapse in Illinois,0.6733310222625732,False
375,Apple Delays Launch of Feature to Scan iPhones for Child Abuse,0.6732967495918274,False
563,Apple Delays Launch of Feature to Scan iPhones for Child Abuse,0.6732967495918274,False
603,Apple Delays Launch of Feature to Scan iPhones for Child Abuse,0.6732967495918274,False
143,Apple Delays Launch of Feature to Scan iPhones for Child Abuse,0.6732967495918274,False
1170,Italy fines Apple over misleading iPhone water-resistance | Cult of Mac,0.6732573509216309,False
92,"Australia's political opposition to support Facebook, Google legislation -sources",0.673151969909668,False
500,"Australia's political opposition to support Facebook, Google legislation -sources",0.673151969909668,False
213,UK online harms bill misses fraud’s gateway,0.673140823841095,False
1133,Facebook accuses Apple of anti-competitive behaviour,0.6731346845626831,False
1415,Fiat Chrysler Automobiles pleads guilty in U.S. labor probe,0.6730929017066956,False
1455,Fiat Chrysler Automobiles pleads guilty in U.S. labor probe,0.6730929017066956,False
935,Apple warns of the perils of installing unapproved apps ahead of antitrust debate in Congress,0.6730359792709351,False
190,Apple warns of the perils of installing unapproved apps ahead of antitrust debate in Congress,0.6730359792709351,False
286,"UPDATE 1-Facebook could be sued by consumer groups, EU court adviser says",0.6730204820632935,True
287,"UPDATE 1-Facebook could be sued by consumer groups, EU court adviser says ",0.6730204820632935,True
1396,Feds warn companies: Fake online reviews could lead to fines,0.6729646921157837,False
1211,Epic gets Apple’s theft claim knocked out of Fortnite fight,0.6729607582092285,False
1004,Russia fines Apple $12 million for alleged app market abuse,0.6729080677032471,False
279,Analysis-Rohingya lawsuit against Facebook a 'wake-up call' for social media,0.6728839874267578,False
181,Federal judge rules Florida social media law likely violates free speech,0.6728641986846924,False
714,Senators urge investigation into Amazon over alleged discrimination against pregnant warehouse workers,0.6728615760803223,False
527,Facebook apologizes for confusing landmark name with offensive term,0.6727391481399536,False
1176,Google 'must face UK online advertising antitrust probe after Brexit',0.6726481914520264,False
671,Amazon com : France moves to shield its book industry from Amazon,0.6726220846176147,False
199,UPDATE 1-Google must face shareholder lawsuit claiming it hid security risks,0.672528088092804,False
201,Hyundai faces lawsuit over EV fires as GM launches recall,0.6725094318389893,False
200,Hyundai faces lawsuit over EV fires as GM launches recall,0.6725094318389893,False
141,Google's voice assistant under new EU antitrust investigation -MLex,0.6724191904067993,False
639,"Investigation opened into Amazon warehouse collapse in Illinois, says labor official",0.6724121570587158,False
909,Walmart Recalls Certain Room Spray Following Two Deaths,0.6722729206085205,False
495,Reaction to Facebook blocking Australian news,0.6722725629806519,False
1469,Taiwan blames human error during test for islandwide power cut,0.6722452640533447,False
197,EU opens probe against Google’s advertising technology,0.672187089920044,False
111,EU: Google Shopping's Primo Placement Is Illegal,0.6721447110176086,False
234,Twitter Sues To Halt Texas AG's Probe Of Trump Ban,0.6721426248550415,False
819,Twitter Sues To Halt Texas AG's Probe Of Trump Ban,0.6721426248550415,False
1025,Twitter Sues To Halt Texas AG's Probe Of Trump Ban,0.6721426248550415,False
468,Twitter Sues To Halt Texas AG's Probe Of Trump Ban,0.6721426248550415,False
1367,SEC investigating Tesla over whistleblower's solar-cell allegations,0.6719603538513184,False
889,Apple under pressure over iPhone security after NSO spyware claims,0.6719486713409424,False
191,"Apple CEO warns congress, claims antitrust bills were rushed, NY Times reports",0.671943187713623,False
936,"Apple CEO warns congress, claims antitrust bills were rushed, NY Times reports",0.671943187713623,False
755,"Apple CEO warns congress, claims antitrust bills were rushed, NY Times reports",0.671943187713623,False
304,FTC Investigating Facebook On User Privacy Concerns: Report,0.6718908548355103,False
988,Apple Faces EU Antitrust Charges Over App Store Payments in Spotify Case,0.6718599796295166,False
476,Shop loses 50% of business after being hit by hacker,0.6718171834945679,False
705,Apple rejects claims photo scanning software creates 'back door' for governments,0.6717643737792969,False
1413,German regulator warns Binance over stock tokens,0.6716744899749756,False
1414,German regulator warns Binance over stock tokens,0.6716744899749756,False
994,German regulator warns Binance over stock tokens,0.6716744899749756,False
56,German regulator warns Binance over stock tokens,0.6716744899749756,False
1316,Tesla faces investor test after big jury award over racism,0.6716140508651733,False
1315,Tesla faces investor test after big jury award over racism,0.6716140508651733,False
1317,Tesla faces investor test after big jury award over racism,0.6716140508651733,False
1019,Franklin (BEN) Faces Lawsuit for Destroying Blockchain Startup,0.6715871691703796,False
560,Apple : Facebook warns it is 'underreporting' iOS ad results amid Apple privacy changes,0.6715782880783081,False
1248,Intel Suing Oregon Engineer Who Joined Microsoft Over Trade Secrets,0.6715630292892456,False
1376,Raytheon warns of worker losses as companies impose vaccine mandate,0.671410083770752,False
542,Facebook Loses Biometric Privacy Breach Case!,0.6713869571685791,False
608,Apple delays plan to scan iPhones for child sex abuse images,0.6713734865188599,False
1454,UPDATE: Ex-VW boss charged with false testimony in dieselgate scandal,0.671301007270813,False
394,"After Google, Apple's Privacy Update Proves Costly For Facebook: Bloomberg",0.6711462736129761,False
158,"After Google, Apple's Privacy Update Proves Costly For Facebook: Bloomberg",0.6711462736129761,False
704,"After Google, Apple's Privacy Update Proves Costly For Facebook: Bloomberg",0.6711462736129761,False
727,"After Google, Apple's Privacy Update Proves Costly For Facebook: Bloomberg",0.6711462736129761,False
800,Amazon finally acknowledges delivery driver bathroom problem,0.6711367964744568,False
3,FTC sues Nvidia to block $40 billion ARM acquisition,0.6710953116416931,False
1325,FTC sues Nvidia to block $40 billion ARM acquisition,0.6710953116416931,False
1324,FTC sues Nvidia to block $40 billion ARM acquisition,0.6710953116416931,False
1461,FTC sues Nvidia to block $40 billion ARM acquisition,0.6710953116416931,False
1408,GM to recall some 2021 cars for faulty air bag warning light,0.6710717678070068,False
1329,SEC probes Tesla over whistleblower claims on solar panel defects,0.6710683107376099,False
1100,Italy considers legal action over Pfizer vaccine delivery delays | Health,0.6710642576217651,False
1238,Antitrust complaint claims Apple's crackdown on user-tracking is unfair,0.6709953546524048,False
1306,Apple files lawsuit against NSO Group,0.6708769202232361,False
1307,Apple files lawsuit against NSO Group,0.6708769202232361,False
622,Apple challenges Classic FM and Radio 3 with Primephonic takeover,0.6708193421363831,False
860,Amazon moves Supreme Court in Future-Reliance deal dispute,0.6708173751831055,False
1036,World’s top insider leaks key Apple Car specs,0.6708097457885742,False
1460,"EU regulators pause investigation into Nvidia, ARM deal",0.6707769632339478,False
1474,Caltech sues Microsoft over Wi-Fi patents from $1 billion Apple case,0.6706706285476685,False
1453,France charges Peugeot with consumer fraud in diesel emissions probe,0.6706442832946777,False
306,"Facebook knew about, failed to police, abusive content globally - documents",0.6706088781356812,False
716,"Japan investigating Amazon cloud disruptions to brokers, airline",0.6705561876296997,False
77,White House warns of 'active threat' from Microsoft email hackers,0.6703462600708008,False
924,"Walmart sued by Kanye West over Yeezy Foam Runners, BI reports",0.6703394055366516,True
53,Pentagon Weighs Ending JEDI Cloud Project Amid Amazon Court Fight,0.6703360080718994,False
768,Pentagon Weighs Ending JEDI Cloud Project Amid Amazon Court Fight,0.6703360080718994,False
1015,CORRECTED-No cameras allowed during Epic Games antitrust trial against Apple,0.6703030467033386,False
554,Australia sues Neoen for lack of power from its Tesla battery reserve,0.6702658534049988,False
553,Australia sues Neoen for lack of power from its Tesla battery reserve,0.6702658534049988,False
552,Australia sues Neoen for lack of power from its Tesla battery reserve,0.6702658534049988,False
1446,Foxconn Partner Byton Faces Challenge for Bankruptcy,0.6701878309249878,False
1273,Foxconn Partner Byton Faces Challenge for Bankruptcy,0.6701878309249878,False
1334,"Apple car unit loses key engineers to Jobi, Archer air taxi upstarts",0.6701586246490479,False
1335,"Apple car unit loses key engineers to Jobi, Archer air taxi upstarts",0.6701586246490479,False
1420,"Apple car unit loses key engineers to Jobi, Archer air taxi upstarts",0.6701586246490479,False
1393,"Apple car unit loses key engineers to Jobi, Archer air taxi upstarts",0.6701586246490479,False
809,Shocking claims from Amazon workers,0.6701334714889526,False
695,Amazon settles with employees who said they were fired over activism,0.6701246500015259,False
1430,"Tesla apologizes after customer protested at autoshow, to share car data with Chinese regulator",0.6701221466064453,False
310,"Australian publisher calls government on Facebook, regulator concerned",0.670008659362793,False
1202,European activist files complaints against Apple's tracking tool | MarketScreener,0.6699801683425903,False
230,Google misled consumers over data collection - Australian watchdog,0.6699181795120239,False
1212,Apple's Theft Claim Against 'Fortnite' Maker Epic Gets Thrown Out By Court,0.6698988676071167,False
503,"Google, in fight against record EU fine, slams regulators for ignoring Apple",0.6698756814002991,False
505,"Google, in fight against record EU fine, slams regulators for ignoring Apple",0.6698756814002991,False
507,"Google, in fight against record EU fine, slams regulators for ignoring Apple",0.6698756814002991,False
508,"Google, in fight against record EU fine, slams regulators for ignoring Apple",0.6698756814002991,False
509,"Google, in fight against record EU fine, slams regulators for ignoring Apple",0.6698756814002991,False
604,Apple : delays system to scan iPhones for child sex abuse content,0.669795036315918,False
1456,California regulator settles with Honda over off-road engine air quality violations,0.6697203516960144,False
1164,"Apple faces fresh lawsuits in Europe for iPhone slowdowns asking for over Rs 1,600 crore compensation",0.6696652173995972,False
1163,"Apple faces fresh lawsuits in Europe for iPhone slowdowns asking for over Rs 1,600 crore compensation",0.6696652173995972,False
329,Facebook makes internal forums private amid leaking scandal,0.669543445110321,False
1385,Apple Places Indian iPhone Factory On Probation For Labor Violations,0.6695334911346436,False
1092,Apple loses copyright claims in lawsuit against U.S. security bug startup,0.6694822907447815,False
1450,Tesla Factories And Warehouses Impacted In Massive Security-Camera Breach: Report,0.6694760918617249,False
196,EU court says YouTube may be liable for copyright breaches,0.6694114208221436,False
1153,Report: Apple Ignored its Partners' Repeated Violations of Chinese Labor Laws - ExtremeTech,0.6693311929702759,False
565,AAPL Stock Price in Danger After Judge (Sort Of) Sides With Epic,0.6692976951599121,False
1052,Thai state drugmaker sues critic of its vaccine procurement,0.6692878007888794,False
1086,Thai state drugmaker sues critic of its vaccine procurement,0.6692878007888794,False
655,Amazon loses physical retail VP after 14 years with the company,0.6692541837692261,False
1046,Facebook is reportedly prepping an antitrust lawsuit against Apple focused on its App Store rules,0.6692012548446655,False
1045,Facebook is reportedly prepping an antitrust lawsuit against Apple focused on its App Store rules,0.6692012548446655,False
526,Facebook is reportedly prepping an antitrust lawsuit against Apple focused on its App Store rules,0.6692012548446655,False
922,Walmart accused of bias against workers with criminal histories,0.6691654920578003,False
756,EU’s Google Ad Tech Probe Strikes at Heart of Business Model,0.6688718795776367,False
